Cloud Computing Concepts, Part 1;Beginner;23;4.4;TRUE;TRUE;https://www.coursera.org/learn/cloud-computing
The Challenges of Global Health;Beginner;20;4.8;TRUE;TRUE;https://www.coursera.org/learn/global-health
Digital Marketing Analytics in Theory;Beginner;20;4.5;TRUE;TRUE;https://www.coursera.org/learn/marketing-analytics
Digital Product Management: Modern Fundamentals;Beginner;11;4.7;TRUE;TRUE;https://www.coursera.org/learn/uva-darden-digital-product-management
Маркетинг в VUCA-мире (часть 2);Intermediate;30;NA;TRUE;TRUE;https://www.coursera.org/learn/--vuca---2
Маркетинг в VUCA-мире (часть 1);Intermediate;30;NA;TRUE;TRUE;https://www.coursera.org/learn/--vuca1
Коронавирусы SARS-CoV-2 и возбудители ОРВИ;NA;12;NA;TRUE;TRUE;https://www.coursera.org/learn/-sars-cov-2
Grow Your Business with Goldman Sachs 10,000 Women;NA;4;4.8;TRUE;FALSE;https://www.coursera.org/learn/10k-women-1
Fundamentals of Negotiation, with Goldman Sachs 10,000 Women;NA;4;4.6;TRUE;FALSE;https://www.coursera.org/learn/10k-women-10
Fundamentals of Business Finance, with Goldman Sachs 10,000 Women;NA;4;4.6;TRUE;FALSE;https://www.coursera.org/learn/10k-women-2
Fundamentals of Leadership, with Goldman Sachs 10,000 Women;NA;3;4.7;TRUE;FALSE;https://www.coursera.org/learn/10k-women-3
Fundamentals of Customers and Competition, with Goldman Sachs 10,000 Women;NA;4;4.8;TRUE;FALSE;https://www.coursera.org/learn/10k-women-4
Fundamentals of Financial Planning, with Goldman Sachs 10,000 Women;NA;3;4.6;TRUE;FALSE;https://www.coursera.org/learn/10k-women-5
Fundamentals of Sales and Marketing, with Goldman Sachs 10,000 Women;NA;4;4.6;TRUE;FALSE;https://www.coursera.org/learn/10k-women-6
Fundamentals of Operations, with Goldman Sachs 10,000 Women;NA;4;4.6;TRUE;FALSE;https://www.coursera.org/learn/10k-women-7
Fundamentals of Management, with Goldman Sachs 10,000 Women;NA;4;4.7;TRUE;FALSE;https://www.coursera.org/learn/10k-women-8
Fundamentals of Funding, with Goldman Sachs 10,000 Women;NA;3;4.7;TRUE;FALSE;https://www.coursera.org/learn/10k-women-9
Expanda Seus Negócios com o 10,000 Women da Goldman Sachs;NA;4;4.9;TRUE;FALSE;https://www.coursera.org/learn/10k-women-brpt-1
Fundamentos de Negociação com o 10,000 Women da Goldman Sachs;NA;4;5.0;TRUE;FALSE;https://www.coursera.org/learn/10k-women-brpt-10
Fundamentos de Finanças da Empresa com o 10,000 Women da Goldman Sachs;NA;3;4.8;TRUE;FALSE;https://www.coursera.org/learn/10k-women-brpt-2
Fundamentos de Liderança com o 10,000 Women da Goldman Sachs;NA;3;4.9;TRUE;FALSE;https://www.coursera.org/learn/10k-women-brpt-3
Fundamentos de Clientes e Concorrência com o 10,000 Women da Goldman Sachs;NA;4;4.9;TRUE;FALSE;https://www.coursera.org/learn/10k-women-brpt-4
Fundamentos de Planejamento Financeiro com o 10,000 Women da Goldman Sachs;NA;3;4.8;TRUE;FALSE;https://www.coursera.org/learn/10k-women-brpt-5
Fundamentos de Vendas e Marketing com o 10,000 Women da Goldman Sachs;NA;4;4.9;TRUE;FALSE;https://www.coursera.org/learn/10k-women-brpt-6
Fundamentos de Operações com o 10,000 Women da Goldman Sachs;NA;4;4.9;TRUE;FALSE;https://www.coursera.org/learn/10k-women-brpt-7
Fundamentos de Gerenciamento com o 10,000 Women da Goldman Sachs;NA;4;5.0;TRUE;FALSE;https://www.coursera.org/learn/10k-women-brpt-8
Fundamentos de Financiamento com o 10,000 Women da Goldman Sachs;NA;3;NA;TRUE;FALSE;https://www.coursera.org/learn/10k-women-brpt-9
Haz Crecer Tu Negocio con Goldman Sachs 10,000 Women;NA;4;4.8;TRUE;FALSE;https://www.coursera.org/learn/10k-women-esp-1
Fundamentos de la Negociación con Goldman Sachs 10,000 Women;NA;4;4.7;TRUE;FALSE;https://www.coursera.org/learn/10k-women-esp-10
Fundamentos de los Aspectos Financieros del Negocio con Goldman Sachs 10,000 Women;NA;3;4.8;TRUE;FALSE;https://www.coursera.org/learn/10k-women-esp-2
Fundamentos del Liderazgo con Goldman Sachs 10,000 Women;NA;3;4.6;TRUE;FALSE;https://www.coursera.org/learn/10k-women-esp-3
Fundamentos de los Clientes y la Competencia con Goldman Sachs 10,000 Women;NA;4;NA;TRUE;FALSE;https://www.coursera.org/learn/10k-women-esp-4
Fundamentos de la Planificación Financiera con Goldman Sachs 10,000 Women;NA;3;NA;TRUE;FALSE;https://www.coursera.org/learn/10k-women-esp-5
Fundamentos de las Ventas y el Marketing con Goldman Sachs 10,000 Women;NA;4;4.8;TRUE;FALSE;https://www.coursera.org/learn/10k-women-esp-6
Fundamentos de las Operaciones con Goldman Sachs 10,000 Women;NA;4;NA;TRUE;FALSE;https://www.coursera.org/learn/10k-women-esp-7
Fundamentos de la Administración con Goldman Sachs 10,000 Women;NA;4;5.0;TRUE;FALSE;https://www.coursera.org/learn/10k-women-esp-8
Fundamentos de la Financiación con Goldman Sachs 10,000 Women;NA;4;NA;TRUE;FALSE;https://www.coursera.org/learn/10k-women-esp-9
Digital Marketing Strategy with Goldman Sachs 10,000 Women;NA;3;NA;TRUE;FALSE;https://www.coursera.org/learn/10kw-digital-marketing
Innovation Strategy with Goldman Sachs 10,000 Women ;NA;3;NA;TRUE;FALSE;https://www.coursera.org/learn/10kw-innovation-strategy
Social Impact Strategy with Goldman Sachs 10,000 Women;NA;3;NA;TRUE;FALSE;https://www.coursera.org/learn/10kw-social-impact
1C:Enterprise Junior Developer Course;Beginner;12;NA;TRUE;TRUE;https://www.coursera.org/learn/1c-enterprise-junior-developer-course
Two Speed IT: How Companies Can Surf the Digital Wave, a BCG Perspective;NA;14;4.3;TRUE;TRUE;https://www.coursera.org/learn/2-speed-it
2021 Cancer Prevention Web-Based Activity (CE eligible);Beginner;12;NA;TRUE;TRUE;https://www.coursera.org/learn/2021-prevent-cancer
20世纪西方音乐 Western Music in the 20th Century;Beginner;14;4.3;TRUE;TRUE;https://www.coursera.org/learn/20cnwm
工程圖學 2D CAD;NA;26;4.8;TRUE;TRUE;https://www.coursera.org/learn/2d-cad
2D image processing;Beginner;14;NA;TRUE;TRUE;https://www.coursera.org/learn/2d-image-processing
3-Axis Machining with Autodesk Fusion 360;Advanced;28;4.9;TRUE;TRUE;https://www.coursera.org/learn/3-axis-machining-autodesk-fusion-360
VR and 360 Video Production;Beginner;13;4.7;TRUE;TRUE;https://www.coursera.org/learn/360-vr-video-production
工程圖學 3D CAD;NA;8;NA;TRUE;TRUE;https://www.coursera.org/learn/3d-cad
3D CAD Application;Intermediate;9;4.9;TRUE;TRUE;https://www.coursera.org/learn/3d-cad-application
3D CAD Fundamental;Beginner;9;4.7;TRUE;TRUE;https://www.coursera.org/learn/3d-cad-fundamental
Current Gen 3D Game Prop Production;Intermediate;15;4.8;TRUE;TRUE;https://www.coursera.org/learn/3d-game-prop-production
3D Graphics in Android: Sensors and VR;Advanced;28;NA;TRUE;TRUE;https://www.coursera.org/learn/3d-graphics-android-sensors-vr
3D Interaction Design in Virtual Reality;Intermediate;13;4.6;TRUE;TRUE;https://www.coursera.org/learn/3d-interaction-design-virtual-reality
3D Model Creation with Autodesk Fusion 360;Advanced;15;4.8;TRUE;TRUE;https://www.coursera.org/learn/3d-model-creation-fusion-360
Создание 3D-моделей объектов на основе цифровых фотоснимков;Beginner;8;NA;TRUE;TRUE;https://www.coursera.org/learn/3d-modeling-based-on-digital-photos
Design Computing: 3D Modeling in Rhinoceros with Python/Rhinoscript;NA;27;5.0;TRUE;TRUE;https://www.coursera.org/learn/3d-modeling-rhinoscript
3D Models for Virtual Reality;Intermediate;16;4.6;TRUE;TRUE;https://www.coursera.org/learn/3d-models-virtual-reality
3D Printing Hardware;;31;4.1;TRUE;TRUE;https://www.coursera.org/learn/3d-print-hardware
3D-печать для всех и каждого;NA;8;4.7;TRUE;TRUE;https://www.coursera.org/learn/3d-printing
3D Printing Applications;Beginner;20;4.6;TRUE;TRUE;https://www.coursera.org/learn/3d-printing-applications
3D Printing Capstone;NA;6;4.3;TRUE;TRUE;https://www.coursera.org/learn/3d-printing-capstone
The 3D Printing Revolution;Beginner;10;4.7;TRUE;TRUE;https://www.coursera.org/learn/3d-printing-revolution
3D Printing Software;Beginner;15;4.7;TRUE;TRUE;https://www.coursera.org/learn/3d-printing-software
3D Reconstruction - Single Viewpoint ;Beginner;11;NA;TRUE;TRUE;https://www.coursera.org/learn/3d-reconstruction---single-viewpoint
3D Reconstruction - Multiple Viewpoints;Beginner;8;NA;TRUE;TRUE;https://www.coursera.org/learn/3d-reconstruction-multiple-viewpoints
Understanding 9/11: Why 9/11 Happened & How Terrorism Affects Our World Today;Beginner;13;4.6;TRUE;TRUE;https://www.coursera.org/learn/911-attack
A General Approach to Risk Management;Beginner;8;NA;TRUE;TRUE;https://www.coursera.org/learn/a-general-approach-to-risk-management
A Organização Centrada na Jornada do Cliente;Beginner;27;NA;TRUE;TRUE;https://www.coursera.org/learn/a-organizacao-centrada-na-jornada-do-cliente
A Practical Introduction to Test-Driven Development;Intermediate;15;NA;TRUE;TRUE;https://www.coursera.org/learn/a-practical-introduction-to-test-driven-development
¡A Programar! Una introducción a la programación;Beginner;12;4.8;TRUE;TRUE;https://www.coursera.org/learn/a-programar
A tanulás tanulása: Hatékony mentális eszközök, melyek segítenek megbirkózni a nehéz tantárgyakkal (Learning How to Learn);Beginner;15;4.9;TRUE;TRUE;https://www.coursera.org/learn/a-tanulas-tanulasa
Advanced App Development in Android Capstone;Intermediate;25;NA;TRUE;TRUE;https://www.coursera.org/learn/aada-capstone
Capstone MOOC for "Android App Development";NA;4;4.2;TRUE;TRUE;https://www.coursera.org/learn/aadcapstone
Introduction to Ableton Live;NA;14;4.8;TRUE;TRUE;https://www.coursera.org/learn/ableton-live
Aboriginal Worldviews and Education;NA;14;4.8;TRUE;TRUE;https://www.coursera.org/learn/aboriginal-education
Abstraction, Problem Decomposition, and Functions;Beginner;17;4.7;TRUE;TRUE;https://www.coursera.org/learn/abstraction-problem-decomposition-functions
Практическое применение техник академической живописи;NA;300;NA;TRUE;TRUE;https://www.coursera.org/learn/acad-paint
Academic Discussions in English;Intermediate;25;4.5;TRUE;TRUE;https://www.coursera.org/learn/academic-discussion-english
Academic Literacy;Intermediate;25;4.6;TRUE;TRUE;https://www.coursera.org/learn/academic-literacy
Academic Skills for University Success: Capstone;NA;33;4.9;TRUE;TRUE;https://www.coursera.org/learn/academic-skills-project
Project: Writing a Research Paper;NA;10;4.7;TRUE;TRUE;https://www.coursera.org/learn/academic-writing-capstone
Academic Information Seeking;NA;6;4.7;TRUE;TRUE;https://www.coursera.org/learn/academicinfoseek
Access Controls ;Beginner;15;4.7;FALSE;TRUE;https://www.coursera.org/learn/access-control-sscp
An Introduction to Accessibility and Inclusive Design;Beginner;15;4.8;TRUE;TRUE;https://www.coursera.org/learn/accessibility
Accessibility to the Scenic Arts;Intermediate;17;4.7;TRUE;TRUE;https://www.coursera.org/learn/accessibility-scenic-arts
Account Management & Sales Force Design;NA;15;4.5;TRUE;TRUE;https://www.coursera.org/learn/account-management
Accountability y gestión del desempeño;Beginner;13;4.5;TRUE;TRUE;https://www.coursera.org/learn/accountability
Accounting Analysis II: Accounting for Liabilities and Equity;Intermediate;22;4.7;TRUE;TRUE;https://www.coursera.org/learn/accounting-analysis-2-equity
Accounting Analysis II: Measurement and Disclosure of Liabilities;Intermediate;20;4.6;TRUE;TRUE;https://www.coursera.org/learn/accounting-analysis-2-liabilities
Accounting Analytics;NA;10;4.5;TRUE;TRUE;https://www.coursera.org/learn/accounting-analytics
Assets in Accounting;Beginner;19;4.1;TRUE;TRUE;https://www.coursera.org/learn/accounting-assets
Accounting, Business and Society:  The Multi-faceted Role of Accounting;Beginner;8;4.8;TRUE;TRUE;https://www.coursera.org/learn/accounting-business-society
Completing the Accounting Cycle;NA;10;4.5;TRUE;TRUE;https://www.coursera.org/learn/accounting-cycle
Data Analytics in Accounting Capstone;Intermediate;19;NA;TRUE;TRUE;https://www.coursera.org/learn/accounting-data-analytics-capstone
Accounting Data Analytics with Python;Intermediate;34;4.1;TRUE;TRUE;https://www.coursera.org/learn/accounting-data-analytics-python
Managerial Accounting: Cost Behaviors, Systems, and Analysis;NA;20;4.7;TRUE;TRUE;https://www.coursera.org/learn/accounting-for-managers
Fundamentals of Accounting Capstone;Beginner;38;NA;TRUE;TRUE;https://www.coursera.org/learn/accounting-fundamentals-project
Accounting Analysis I: The Role of Accounting as an Information System;Intermediate;26;4.8;TRUE;TRUE;https://www.coursera.org/learn/accounting-information-system
Achieving Health Equity in Healthcare;Intermediate;15;NA;TRUE;TRUE;https://www.coursera.org/learn/achieving-health-equity-in-healthcare
NA;NA;NA;NA;FALSE;FALSE;https://www.coursera.org/learn/achieving-your-optimal-performance
Acing the Product Management Interview;Beginner;15;4.7;TRUE;TRUE;https://www.coursera.org/learn/acing-product-management-interviews
Act on Climate: Steps to Individual, Community, and Political Action;Beginner;25;4.8;TRUE;TRUE;https://www.coursera.org/learn/act-on-climate
Digital business - Act on the digital world;NA;11;NA;TRUE;TRUE;https://www.coursera.org/learn/act-on-digital-world
ART of the MOOC: Activism and Social Movements;NA;10;4.5;TRUE;TRUE;https://www.coursera.org/learn/activism-social-movements
Activism in Sports and Culture  ;Beginner;15;4.8;TRUE;TRUE;https://www.coursera.org/learn/activism-sports-culture
ART of the MOOC: Activismo y Movimientos Sociales;NA;16;4.6;TRUE;TRUE;https://www.coursera.org/learn/activismo-movimientos-sociales
Actúa ante el dolor crónico;Beginner;23;4.6;TRUE;TRUE;https://www.coursera.org/learn/actua-dolor-cronico
Actualización en el manejo del paciente con diabetes mellitus tipo 2;NA;12;4.8;TRUE;TRUE;https://www.coursera.org/learn/actualizacion-manejo-diabetes-tipo-2
Acuerdos globales para el desarrollo sostenible;Beginner;11;4.8;TRUE;TRUE;https://www.coursera.org/learn/acuerdos-globales
 Prehospital care of acute stroke and patient selection for endovascular treatment using the RACE scale;Intermediate;12;4.8;TRUE;TRUE;https://www.coursera.org/learn/acute-stroke-race-scale
Adaptability and Resiliency;Beginner;9;4.7;TRUE;TRUE;https://www.coursera.org/learn/adaptability-and-resiliency
The Addicted Brain;Beginner;22;4.6;TRUE;TRUE;https://www.coursera.org/learn/addiction-and-the-brain
Addiction Treatment: Clinical Skills for Healthcare Providers;Beginner;15;4.9;TRUE;TRUE;https://www.coursera.org/learn/addiction-treatment
Additive Manufacturing;Beginner;12;NA;TRUE;TRUE;https://www.coursera.org/learn/additive-manufacturing-3d-printing
Additive Technologies in Metallurgy & Mechanical Engineering;Intermediate;14;4.2;TRUE;TRUE;https://www.coursera.org/learn/additive-technologies-in-metallurgy--mechanical-engineering
Аддитивные технологии (3D-печать). Вводный курс;Beginner;14;4.8;TRUE;TRUE;https://www.coursera.org/learn/additivnye-tekhnologii
Address Business Issues with Data Science ;Intermediate;7;NA;TRUE;TRUE;https://www.coursera.org/learn/address-business-issues-with-data-science
ADHD: Everyday Strategies for Elementary Students;Beginner;8;4.7;TRUE;TRUE;https://www.coursera.org/learn/adhd-treatment
Adjectives and Adjective Clauses;NA;25;4.8;TRUE;TRUE;https://www.coursera.org/learn/adjective-clauses
Administração de Sistemas e Serviços de Infraestrutura de TI;Beginner;30;4.9;TRUE;TRUE;https://www.coursera.org/learn/administracao-de-sistemas-servicos-infraestrutura-ti
Administração Financeira;Beginner;23;4.8;TRUE;TRUE;https://www.coursera.org/learn/administracao-financeira
Administración de Proyectos Project;NA;5;4.7;TRUE;TRUE;https://www.coursera.org/learn/administracion-de-proyectos-capstone
Administración de Recursos Humanos;Beginner;11;4.7;TRUE;TRUE;https://www.coursera.org/learn/administracion-de-recursos-humanos
Administración de sistemas y servicios de infraestructura de TI;Beginner;30;4.9;TRUE;TRUE;https://www.coursera.org/learn/administracion-de-sistema-y-servicios-de-infraestructura
Administración Estratégica y Emprendedora;NA;8;4.7;TRUE;TRUE;https://www.coursera.org/learn/administracion-estrategica
Administración de las Tecnologías de la Información;Beginner;11;4.4;TRUE;TRUE;https://www.coursera.org/learn/administracion-tecnologias-informacion
Administrasi Sistem dan Layanan Infrastruktur TI;Beginner;28;NA;TRUE;TRUE;https://www.coursera.org/learn/administrasi-sistem-dan-layanan-infrastruktur-ti
Administración financiera y su función en la empresa ;Intermediate;10;4.8;TRUE;TRUE;https://www.coursera.org/learn/admonfinanciera
Adobe Illustrator для начинающих ;Beginner;15;NA;TRUE;TRUE;https://www.coursera.org/learn/adobe-illustrator
Adobe Illustrator for Beginners;Beginner;15;NA;TRUE;TRUE;https://www.coursera.org/learn/adobe-illustrator-beginners
Векторная графика. Adobe Illustrator CC;Beginner;33;4.4;TRUE;TRUE;https://www.coursera.org/learn/adobe-illustrator-cc
Big Data: adquisición y almacenamiento de datos;Intermediate;11;4.4;TRUE;TRUE;https://www.coursera.org/learn/adquisicion-almacenamiento-de-datos
Advanced Reproducibility in Cancer Informatics;Advanced;10;NA;TRUE;TRUE;https://www.coursera.org/learn/adv-reproducibility-cancer-informatics
Advanced AI Techniques for the Supply Chain;Intermediate;22;NA;TRUE;TRUE;https://www.coursera.org/learn/advanced-ai-techniques-for-the-supply-chain
Advanced Algorithms and Complexity;Advanced;27;4.6;TRUE;TRUE;https://www.coursera.org/learn/advanced-algorithms-and-complexity
Advanced Chemistry;NA;17;4.7;TRUE;FALSE;https://www.coursera.org/learn/advanced-chemistry
Advanced Clinical Data Science;Intermediate;4;4.9;TRUE;TRUE;https://www.coursera.org/learn/advanced-clinical-data-science
Advanced Competitive Strategy;NA;12;4.7;TRUE;TRUE;https://www.coursera.org/learn/advanced-competitive-strategy
高阶竞争策略（中文版）;NA;10;4.8;TRUE;FALSE;https://www.coursera.org/learn/advanced-competitive-strategy-zh
Advanced Computer Vision with TensorFlow;Intermediate;29;4.8;TRUE;TRUE;https://www.coursera.org/learn/advanced-computer-vision-with-tensorflow
Advanced Data Science Capstone;Advanced;9;4.6;TRUE;TRUE;https://www.coursera.org/learn/advanced-data-science-capstone
Advanced Data Structures in Java;Intermediate;29;4.8;TRUE;TRUE;https://www.coursera.org/learn/advanced-data-structures
Advanced Deployment Scenarios with TensorFlow;Intermediate;18;4.7;TRUE;TRUE;https://www.coursera.org/learn/advanced-deployment-scenarios-tensorflow
Data Visualization with Advanced Excel;Beginner;15;4.8;TRUE;TRUE;https://www.coursera.org/learn/advanced-excel
Advanced Financial Reporting: Accounting for Business Combinations and Preparation of Consolidated Financial Statements;Advanced;25;4.7;TRUE;TRUE;https://www.coursera.org/learn/advanced-financial-reporting
Advanced Functional Ceramics;NA;16;4.7;TRUE;TRUE;https://www.coursera.org/learn/advanced-functional-ceramics
Advanced Grammar & Punctuation Project;Advanced;20;4.8;TRUE;TRUE;https://www.coursera.org/learn/advanced-grammar-project
Advanced Information Literacy;Intermediate;18;NA;TRUE;TRUE;https://www.coursera.org/learn/advanced-information-literacy
Продвинутые методы машинного обучения;Intermediate;45;NA;TRUE;TRUE;https://www.coursera.org/learn/advanced-machine-learning-methods
Advanced Machine Learning and Signal Processing;Advanced;27;4.5;TRUE;TRUE;https://www.coursera.org/learn/advanced-machine-learning-signal-processing
Advanced Manufacturing Enterprise;Beginner;18;4.6;TRUE;TRUE;https://www.coursera.org/learn/advanced-manufacturing-enterprise
Advanced Manufacturing Process Analysis;Beginner;13;4.6;TRUE;TRUE;https://www.coursera.org/learn/advanced-manufacturing-process-analysis
Mastering Programming with MATLAB;Intermediate;56;4.8;TRUE;TRUE;https://www.coursera.org/learn/advanced-matlab-programming
Overview of Advanced Methods of Reinforcement Learning in Finance;Advanced;13;3.8;TRUE;TRUE;https://www.coursera.org/learn/advanced-methods-reinforcement-learning-finance
Advanced Modeling for Discrete Optimization;Intermediate;47;4.9;TRUE;TRUE;https://www.coursera.org/learn/advanced-modeling
Advanced Models for Decision Making;Beginner;14;4.9;TRUE;TRUE;https://www.coursera.org/learn/advanced-models-for-decision-making
Advanced Neurobiology I;Intermediate;27;4.1;TRUE;TRUE;https://www.coursera.org/learn/advanced-neurobiology1
Advanced Portfolio Construction and Analysis with Python;Intermediate;11;4.7;TRUE;TRUE;https://www.coursera.org/learn/advanced-portfolio-construction-python
Advanced R Programming;Intermediate;18;4.3;TRUE;TRUE;https://www.coursera.org/learn/advanced-r
Advanced Recommender Systems;Intermediate;15;NA;TRUE;TRUE;https://www.coursera.org/learn/advanced-recommender-systems
Creating Advanced Reports with SAS Visual Analytics;Intermediate;9;4.7;TRUE;TRUE;https://www.coursera.org/learn/advanced-reports-sas-va
Advanced SAS Programming Techniques;Intermediate;17;4.9;TRUE;TRUE;https://www.coursera.org/learn/advanced-sas-programming-techniques
Advanced System Security Topics;Beginner;15;4.5;TRUE;TRUE;https://www.coursera.org/learn/advanced-system-security-topics
Advanced Trading Algorithms;Intermediate;11;4.6;TRUE;TRUE;https://www.coursera.org/learn/advanced-trading-algorithms
Advanced Valuation and Strategy - M&A, Private Equity, and Venture Capital;;16;4.6;TRUE;TRUE;https://www.coursera.org/learn/advanced-valuation-and-strategy
Advanced Writing;;20;4.7;TRUE;TRUE;https://www.coursera.org/learn/advanced-writing
Advanced Neurobiology II;Intermediate;26;4.3;TRUE;TRUE;https://www.coursera.org/learn/advancedneurobiologyii
Advertising with Facebook;Beginner;10;4.8;TRUE;TRUE;https://www.coursera.org/learn/advertising-with-facebook
Aerial Photography with UAV;NA;11;4.3;TRUE;TRUE;https://www.coursera.org/learn/aerial-photography-with-uav
Digitalisation in Aeronautics;Intermediate;10;4.7;TRUE;TRUE;https://www.coursera.org/learn/aeronautics
Aerospace materials;Intermediate;11;4.6;TRUE;TRUE;https://www.coursera.org/learn/aerospace-materials
African cities : An Introduction to Urban Planning;Intermediate;40;4.7;TRUE;TRUE;https://www.coursera.org/learn/african-cities1
African development – from the past to the present;Beginner;27;3.3;TRUE;TRUE;https://www.coursera.org/learn/african-development--from-the-past-to-the-present
Afrique et mondialisation, regards croisés;Beginner;15;4.7;TRUE;TRUE;https://www.coursera.org/learn/afrique-mondialisation
After the Arab Spring – Democratic Aspirations and State Failure;Beginner;25;4.7;TRUE;TRUE;https://www.coursera.org/learn/after-the-arab-spring
Age of Cathedrals;Beginner;18;4.7;TRUE;TRUE;https://www.coursera.org/learn/age-of-cathedrals
Age of Jefferson;Beginner;10;4.7;TRUE;TRUE;https://www.coursera.org/learn/ageofjefferson
Agile with Atlassian Jira;Beginner;13;4.7;TRUE;TRUE;https://www.coursera.org/learn/agile-atlassian-jira
Agile Leadership Capstone;Beginner;6;4.9;TRUE;TRUE;https://www.coursera.org/learn/agile-capstone
Introduction to Agile Development and Scrum;Beginner;10;4.9;TRUE;TRUE;https://www.coursera.org/learn/agile-development-and-scrum
Agile Leader Training;Beginner;15;4.7;TRUE;TRUE;https://www.coursera.org/learn/agile-leader-training
Agile Leadership: Introduction to Change;Beginner;9;4.7;TRUE;TRUE;https://www.coursera.org/learn/agile-leadership-introduction-to-change
Agile Organization;Beginner;10;4.7;TRUE;TRUE;https://www.coursera.org/learn/agile-leadership-organization
Agile Planning for Software Products;NA;12;4.8;TRUE;TRUE;https://www.coursera.org/learn/agile-planning-for-software-products
Agile Project Management;Beginner;22;4.8;TRUE;TRUE;https://www.coursera.org/learn/agile-project-management
Agile Software Development;Intermediate;12;4.7;TRUE;TRUE;https://www.coursera.org/learn/agile-software-development
Desarrollo de software Agile;Intermediate;13;NA;TRUE;TRUE;https://www.coursera.org/learn/agile-software-development-es
Healthy Aging and the Future of Cannabis Research;Beginner;8;4.8;TRUE;TRUE;https://www.coursera.org/learn/aging-research-cannabis-cbd-thc
農企業管理學 (Agribusiness Management);Beginner;12;NA;TRUE;TRUE;https://www.coursera.org/learn/agribusiness-management
Challenges of Agribusiness Management;NA;5;4.8;TRUE;TRUE;https://www.coursera.org/learn/agribusiness-management-challenges
Agricultura urbana y periurbana;Beginner;9;4.7;TRUE;TRUE;https://www.coursera.org/learn/agricultura-urbana
Agriculture, Economics and Nature;Beginner;17;4.7;TRUE;TRUE;https://www.coursera.org/learn/agriculture-economics-nature
Основы рационального использования агроландшафтов;NA;12;NA;TRUE;TRUE;https://www.coursera.org/learn/agrland
Applied AI with DeepLearning;Advanced;24;4.4;TRUE;TRUE;https://www.coursera.org/learn/ai
Artificial Intelligence Algorithms Models and Limitations;Beginner;8;4.7;TRUE;TRUE;https://www.coursera.org/learn/ai-algorithm-limitations
AI and the Illusion of Intelligence;Beginner;10;NA;TRUE;TRUE;https://www.coursera.org/learn/ai-and-the-illusion-of-intelligence
AI, Business & the Future of Work;Beginner;12;NA;TRUE;TRUE;https://www.coursera.org/learn/ai-business-future-of-work
Artificial Intelligence Data Fairness and Bias						;Beginner;6;4.8;TRUE;TRUE;https://www.coursera.org/learn/ai-data-bias
AI Capstone Project with Deep Learning ;Advanced;16;4.5;TRUE;TRUE;https://www.coursera.org/learn/ai-deep-learning-capstone
Artificial Intelligence: Ethics & Societal Challenges;Beginner;13;NA;TRUE;TRUE;https://www.coursera.org/learn/ai-ethics
Artificial Intelligence Ethics in Action;Intermediate;6;NA;TRUE;TRUE;https://www.coursera.org/learn/ai-ethics-analysis
Capstone Project: Advanced AI for Drug Discovery;Intermediate;12;NA;TRUE;TRUE;https://www.coursera.org/learn/ai-for-drug-discovery
AI For Everyone;Beginner;12;4.8;TRUE;TRUE;https://www.coursera.org/learn/ai-for-everyone
الذكاء الاصطناعي للجميع;Beginner;6;4.8;TRUE;TRUE;https://www.coursera.org/learn/ai-for-everyone-ar
KI für alle;Beginner;6;NA;TRUE;TRUE;https://www.coursera.org/learn/ai-for-everyone-de
