Physique des particules - une introduction;Intermediate;39;4.3;TRUE;TRUE;https://www.coursera.org/learn/physique-particules
The Piano Sonata: Beethoven and the Romantics;Intermediate;12;NA;TRUE;TRUE;https://www.coursera.org/learn/piano-sonata-beethoven-to-romantics
The Piano Sonata: Origins to Mozart;Intermediate;10;NA;TRUE;TRUE;https://www.coursera.org/learn/piano-sonata-origins-to-mozart
The Piano Sonata: Russian and 20th-21st Century Composers;Intermediate;13;NA;TRUE;TRUE;https://www.coursera.org/learn/piano-sonata-russian-20-21-century-composers
Pixel Art for Video Games;Beginner;9;4.5;TRUE;TRUE;https://www.coursera.org/learn/pixel-art-video-games
El plan de marketing;Beginner;9;4.7;TRUE;TRUE;https://www.coursera.org/learn/plan-de-marketing
Planet Earth...and You!;Beginner;42;4.9;TRUE;TRUE;https://www.coursera.org/learn/planet-earth
Planificación y gestión estratégica para Pymes;Beginner;21;4.8;TRUE;TRUE;https://www.coursera.org/learn/planificacion-gestion-pymes
Iniciación y Planificación de Proyectos;NA;6;4.7;TRUE;TRUE;https://www.coursera.org/learn/planificacion-proyectos
Planification des mobilités;Beginner;29;4.3;TRUE;TRUE;https://www.coursera.org/learn/planification-mobilites
Planned Giving;Beginner;13;NA;TRUE;TRUE;https://www.coursera.org/learn/planned-giving
Supply Chain Planning;Beginner;14;4.7;TRUE;TRUE;https://www.coursera.org/learn/planning
Planning, Auditing and Maintaining Enterprise Systems;Intermediate;12;4.7;TRUE;TRUE;https://www.coursera.org/learn/planning-auditing-maintaining-enterprise-systems
Planning and Organizing for Supervisors;Beginner;10;4.8;TRUE;TRUE;https://www.coursera.org/learn/planning-organizing-supervisors
Planning with Climate Change in Mind;Beginner;6;NA;TRUE;TRUE;https://www.coursera.org/learn/planning-with-climate-change-in-mind
Plant Bioinformatics;Intermediate;14;4.8;TRUE;TRUE;https://www.coursera.org/learn/plant-bioinformatics
Plant Bioinformatics Capstone;Intermediate;9;4.7;TRUE;TRUE;https://www.coursera.org/learn/plant-bioinformatics-capstone
Understanding Plants - Part II: Fundamentals of Plant Biology;Intermediate;6;4.8;TRUE;TRUE;https://www.coursera.org/learn/plant-biology
Генетика развития растений;Advanced;28;NA;TRUE;TRUE;https://www.coursera.org/learn/plantgen
Understanding Plants - Part I: What a Plant Knows;Beginner;11;4.8;TRUE;TRUE;https://www.coursera.org/learn/plantknows
Plastic electronics;Intermediate;6;4.6;TRUE;TRUE;https://www.coursera.org/learn/plastic-electronics
Ancient Philosophy: Plato & His Predecessors;NA;13;4.8;TRUE;TRUE;https://www.coursera.org/learn/plato
Reason and Persuasion: Thinking Through Three Dialogues By Plato;NA;33;4.5;TRUE;FALSE;https://www.coursera.org/learn/plato-dialogues
The Art & Science of Product Management;Beginner;10;4.6;TRUE;TRUE;https://www.coursera.org/learn/pms-leading-design-engineering-ai-ml
Point of Care Testing for Sexually Transmitted Infections;Beginner;6;NA;TRUE;TRUE;https://www.coursera.org/learn/poct-for-sti
現代文學導讀：詩、散文、小說;Beginner;6;NA;TRUE;TRUE;https://www.coursera.org/learn/poetry-prose-novel
Sharpened Visions: A Poetry Workshop;Beginner;8;4.8;TRUE;TRUE;https://www.coursera.org/learn/poetry-workshop
Pointers, Arrays, and Recursion;Beginner;21;4.4;TRUE;TRUE;https://www.coursera.org/learn/pointers-arrays-recursion
Police Brutality in America Teach-Out;Beginner;7;4.8;TRUE;FALSE;https://www.coursera.org/learn/police-brutality-in-america-teach-out
Community Awareness: Police Brutality in the U.S. ;Beginner;17;NA;TRUE;FALSE;https://www.coursera.org/learn/police-brutality-in-the-united-states
Political Economy of Institutions and Development;Beginner;23;4.8;TRUE;TRUE;https://www.coursera.org/learn/political-economy
Political Geography;Beginner;16;NA;TRUE;TRUE;https://www.coursera.org/learn/political-geography
Political Geography and the Modern World;Beginner;16;NA;TRUE;TRUE;https://www.coursera.org/learn/political-geography-and-the-modern-world
Political Governance and Public Policy in Russia;Beginner;13;4.7;TRUE;TRUE;https://www.coursera.org/learn/political-governance-russia
Политическая география;Beginner;24;4.9;TRUE;TRUE;https://www.coursera.org/learn/politicheskaya-geografiya
Сравнительная политика (Comparative Politics);NA;32;4.6;TRUE;TRUE;https://www.coursera.org/learn/politika-sravnitelnaja
Algebra: Elementary to Advanced - Polynomials and Roots;Beginner;9;5.0;TRUE;TRUE;https://www.coursera.org/learn/polynomials-roots
Учимся понимать ребёнка: руководство для взрослых;Beginner;5;4.8;TRUE;FALSE;https://www.coursera.org/learn/ponimat-rebenka
Value-Based Care: Population Health;Beginner;7;4.8;TRUE;TRUE;https://www.coursera.org/learn/pop-health
Psychology of Popularity;Beginner;8;4.7;TRUE;TRUE;https://www.coursera.org/learn/popularity
Population Health: Health & Health Behaviour;Intermediate;27;3.9;TRUE;TRUE;https://www.coursera.org/learn/population-health-behaviour
Population Health: Governance;Beginner;14;NA;TRUE;TRUE;https://www.coursera.org/learn/population-health-governance
Population Health: Predictive Analytics;Intermediate;18;4.8;TRUE;TRUE;https://www.coursera.org/learn/population-health-predictive-analytics
Population Health: Study Design;Intermediate;29;NA;TRUE;TRUE;https://www.coursera.org/learn/population-health-study-design
Los portafolios y las inversiones en el mercado de capitales;Intermediate;13;NA;TRUE;TRUE;https://www.coursera.org/learn/portafolios-inversiones-en-mercado-de-capitales
Портфельные инвестиции: активные и пассивные стратегии;NA;12;4.5;TRUE;TRUE;https://www.coursera.org/learn/portfelnyye-investitsii
Portfolio and Risk Management;Beginner;9;4.5;TRUE;TRUE;https://www.coursera.org/learn/portfolio-management
Portfolio and Risk Management;NA;8;4.7;TRUE;TRUE;https://www.coursera.org/learn/portfolio-risk-management
Portfolio Selection and Risk Management;NA;23;4.6;TRUE;TRUE;https://www.coursera.org/learn/portfolio-selection-risk-management
Posicionamiento: La base del éxito en la estrategia de marketing;Beginner;9;4.8;TRUE;TRUE;https://www.coursera.org/learn/posicionamiento
Positioning: What you need for a successful Marketing Strategy;Beginner;11;4.5;TRUE;TRUE;https://www.coursera.org/learn/positioning
Positive Psychiatry and Mental Health ;NA;20;4.8;TRUE;TRUE;https://www.coursera.org/learn/positive-psychiatry
Positive Psychology ;NA;11;4.7;TRUE;TRUE;https://www.coursera.org/learn/positive-psychology
Positive Psychology: Applications and Interventions;Beginner;17;4.8;TRUE;TRUE;https://www.coursera.org/learn/positive-psychology-applications
Positive Psychology: Character, Grit and Research Methods;Beginner;24;4.4;TRUE;TRUE;https://www.coursera.org/learn/positive-psychology-methods
Positive Psychology Specialization Project: Design Your Life for Well-being;NA;13;4.8;TRUE;TRUE;https://www.coursera.org/learn/positive-psychology-project
Positive Psychology: Resilience Skills;Beginner;16;4.9;TRUE;TRUE;https://www.coursera.org/learn/positive-psychology-resilience
Positive Psychology: Martin E. P. Seligman’s Visionary Science;Beginner;16;4.9;TRUE;TRUE;https://www.coursera.org/learn/positive-psychology-visionary-science
Global Postharvest Loss Prevention: Fundamentals, Technologies, and Actors;Beginner;13;4.8;TRUE;TRUE;https://www.coursera.org/learn/postharvest
Potenciando mi aprendizaje en el primer año de Universidad;Beginner;22;4.8;TRUE;TRUE;https://www.coursera.org/learn/potenciando-aprendizaje
Poverty & Population: How Demographics Shape Policy;Beginner;12;4.9;TRUE;TRUE;https://www.coursera.org/learn/poverty-population-demographics-policy
Power Onboarding;Beginner;7;4.0;TRUE;TRUE;https://www.coursera.org/learn/power-onboarding
Power and Sample Size for Multilevel and Longitudinal Study Designs;Intermediate;24;4.4;TRUE;TRUE;https://www.coursera.org/learn/power-sample-size
Effective Business Presentations with Powerpoint;Beginner;11;4.6;TRUE;TRUE;https://www.coursera.org/learn/powerpoint-presentations
Практики цифровой трансформации;NA;10;NA;TRUE;TRUE;https://www.coursera.org/learn/pracdig
Practices of Digital Transformation;NA;8;NA;TRUE;TRUE;https://www.coursera.org/learn/pracdig-eng
Practical Crowdsourcing for Efficient Machine Learning;Beginner;17;NA;TRUE;TRUE;https://www.coursera.org/learn/practical-crowdsourcing
Practical Machine Learning;NA;9;4.5;TRUE;TRUE;https://www.coursera.org/learn/practical-machine-learning
Practical Python for AI Coding 1;Beginner;11;NA;TRUE;TRUE;https://www.coursera.org/learn/practical-python-for-ai-coding--preparation-for-coding
Practical Python for AI Coding 2;Beginner;9;NA;TRUE;TRUE;https://www.coursera.org/learn/practical-python-for-ai-coding-2
Practical Reinforcement Learning;Advanced;26;4.3;TRUE;TRUE;https://www.coursera.org/learn/practical-rl
Practical Time Series Analysis;Intermediate;26;4.6;TRUE;TRUE;https://www.coursera.org/learn/practical-time-series-analysis
Practicing Gratitude Teach-Out ;Beginner;4;4.7;TRUE;FALSE;https://www.coursera.org/learn/practicing-gratitude-teach-out
Practicing for the SAS Programming Certification Exam;Intermediate;9;4.9;TRUE;TRUE;https://www.coursera.org/learn/practicing-sas-programming-certification
Практики оперативной аналитики в MS Excel;Beginner;12;4.8;TRUE;TRUE;https://www.coursera.org/learn/praktiki-operativnoy-analitiki-excel
Практики работы с данными средствами Power Query и Power Pivot;Advanced;12;4.8;TRUE;TRUE;https://www.coursera.org/learn/praktiki-raboty-dannymi-sredstvami-power-query-pivot
Практики создания аналитических панелей в среде Microsoft Power BI;Advanced;10;4.6;TRUE;TRUE;https://www.coursera.org/learn/praktiki-sozdaniya-analiticheskikh-paneley-power-bi
Практики управленческой аналитики в MS Excel;Intermediate;10;4.8;TRUE;TRUE;https://www.coursera.org/learn/praktiki-upravlencheskoy-analitiki-excel
Универсальные практики влияния;Intermediate;19;4.9;TRUE;TRUE;https://www.coursera.org/learn/praktiki-vliyaniya
Правовое регулирование налога на прибыль в Российской Федерации;Beginner;8;NA;TRUE;TRUE;https://www.coursera.org/learn/pravovoe-regulirovanie-naloga-na-pribyl
Правовое обеспечение бизнеса в России;NA;5;NA;TRUE;TRUE;https://www.coursera.org/learn/pravovoye-obespecheniye-biznesa
Правовые формы ведения бизнеса в России;Beginner;5;4.5;TRUE;TRUE;https://www.coursera.org/learn/pravovyye-formy-vedeniya-biznesa-rossii
Precalculus: Mathematical Modeling;Beginner;10;4.5;TRUE;TRUE;https://www.coursera.org/learn/precalculus-mathematical-modelling
Precalculus: Periodic Functions;Beginner;9;4.7;TRUE;TRUE;https://www.coursera.org/learn/precalculus-periodic-functions
Precalculus: Relations and Functions;Beginner;12;4.6;TRUE;TRUE;https://www.coursera.org/learn/precalculus-relations-functions
Precision Medicine;Intermediate;28;3.8;TRUE;TRUE;https://www.coursera.org/learn/precision-medicine
Prediction and Control with Function Approximation;Intermediate;22;4.8;TRUE;TRUE;https://www.coursera.org/learn/prediction-control-function-approximation
Prediction Models with Sports Data;NA;33;NA;TRUE;TRUE;https://www.coursera.org/learn/prediction-models-sports-data
Practical Predictive Analytics: Models and Methods;NA;7;4.1;TRUE;TRUE;https://www.coursera.org/learn/predictive-analytics
Predictive Analytics and Data Mining;Intermediate;24;4.4;TRUE;TRUE;https://www.coursera.org/learn/predictive-analytics-data-mining
Predictive Modeling and Analytics ;NA;11;3.6;TRUE;TRUE;https://www.coursera.org/learn/predictive-modeling-analytics
Predictive Modeling and Machine Learning with MATLAB;Intermediate;22;4.8;TRUE;TRUE;https://www.coursera.org/learn/predictive-modeling-machine-learning
Predictive Modeling, Model Fitting, and Regression Analysis;Intermediate;4;4.3;TRUE;TRUE;https://www.coursera.org/learn/predictive-modeling-model-fitting-regression-analysis
Основы поиска дела жизни. Часть 1. Как перестать откладывать дела на потом?;Beginner;11;4.7;TRUE;TRUE;https://www.coursera.org/learn/prednaznachenie-delo-jizni
Организация предпринимательской деятельности;Intermediate;15;NA;TRUE;TRUE;https://www.coursera.org/learn/predprinimatelstvo
PrEParing: PrEP for Providers and Patients;Beginner;16;4.7;TRUE;TRUE;https://www.coursera.org/learn/prep
Prepare for the EMT Certification Test;Beginner;11;4.6;TRUE;TRUE;https://www.coursera.org/learn/prepare-emt-certification-test
Prepare for DP-100: Data Science on Microsoft Azure Exam;Intermediate;9;NA;TRUE;TRUE;https://www.coursera.org/learn/prepare-for-dp-100-design-a-data-science-solution-on-azure
Preparing for the Google Cloud Associate Cloud Engineer Exam;Intermediate;8;4.7;TRUE;TRUE;https://www.coursera.org/learn/preparing-cloud-associate-cloud-engineer-exam
Preparing for Google Associate Cloud Engineer Exam Español;Beginner;8;NA;FALSE;TRUE;https://www.coursera.org/learn/preparing-cloud-associate-cloud-engineer-exam-es
Preparing for Google Associate Cloud Engineer Exam 日本語版;Beginner;8;NA;TRUE;TRUE;https://www.coursera.org/learn/preparing-cloud-associate-cloud-engineer-exam-jp
Preparing Google Associate Cloud Engineer Exam em Português;Beginner;8;NA;FALSE;TRUE;https://www.coursera.org/learn/preparing-cloud-associate-cloud-engineer-exam-pt
Preparing for the Google Cloud Professional Cloud Architect Exam;Advanced;13;4.7;TRUE;TRUE;https://www.coursera.org/learn/preparing-cloud-professional-cloud-architect-exam
Preparing for the Google Cloud Professional Cloud Architect Exam em Português Brasileiro;Advanced;10;NA;TRUE;FALSE;https://www.coursera.org/learn/preparing-cloud-professional-cloud-architect-exam-br
Preparing for the Google Cloud Professional Cloud Architect Exam en Español;Advanced;10;NA;TRUE;TRUE;https://www.coursera.org/learn/preparing-cloud-professional-cloud-architect-exam-es
Preparing Cloud Professional Cloud Architect Exam italiano;Advanced;13;NA;TRUE;TRUE;https://www.coursera.org/learn/preparing-cloud-professional-cloud-architect-exam-it
Preparing for the Google Cloud Professional Cloud Architect Exam 日本語版;Advanced;10;NA;TRUE;TRUE;https://www.coursera.org/learn/preparing-cloud-professional-cloud-architect-exam-jp
Preparing for the Google Cloud Professional Data Engineer Exam;Advanced;9;4.6;TRUE;TRUE;https://www.coursera.org/learn/preparing-cloud-professional-data-engineer-exam
Preparing for the Google Cloud Professional Data Engineer Exam em Português Brasileiro;Advanced;7;NA;TRUE;TRUE;https://www.coursera.org/learn/preparing-cloud-professional-data-engineer-exam-br
Preparing for the Google Cloud Professional Data Engineer Exam en Español;Advanced;7;NA;TRUE;TRUE;https://www.coursera.org/learn/preparing-cloud-professional-data-engineer-exam-es
Preparing for the Google Cloud Professional Data Engineer Exam 日本語版;Advanced;7;NA;TRUE;TRUE;https://www.coursera.org/learn/preparing-cloud-professional-data-engineer-exam-jp
Getting Started with SAS Visual Analytics ;Beginner;5;4.7;TRUE;TRUE;https://www.coursera.org/learn/preparing-data-sas-va
Preparing for and Passing Technical Certifications;Beginner;6;4.8;TRUE;TRUE;https://www.coursera.org/learn/preparing-for-and-passing-technical-certifications
Preparing for Your CertNexus Certification Exam;Beginner;2;NA;TRUE;TRUE;https://www.coursera.org/learn/preparing-for-your-certnexus-certification-exam
Preparing for the SAS Programming Certification Exam ;Intermediate;16;4.8;TRUE;TRUE;https://www.coursera.org/learn/preparing-sas-programming-certification
Graphic Design;Beginner;29;4.8;TRUE;TRUE;https://www.coursera.org/learn/presentation-design
Дизайн презентаций;NA;6;4.9;TRUE;TRUE;https://www.coursera.org/learn/presentation-designs
Представление презентации;Beginner;3;NA;TRUE;TRUE;https://www.coursera.org/learn/presentation-of-presentation
Successful Presentation;Beginner;21;4.8;TRUE;TRUE;https://www.coursera.org/learn/presentation-skills
(Successful Presentation) العرض التقديمي الناجح;Beginner;16;4.8;TRUE;TRUE;https://www.coursera.org/learn/presentation-skills-ar
Presentations: Speaking so that People Listen;Intermediate;25;4.5;TRUE;TRUE;https://www.coursera.org/learn/presentations-speaking-so-that-people-listen
Recovering the Humankind's Past and Saving the Universal Heritage;NA;13;4.3;TRUE;TRUE;https://www.coursera.org/learn/preserving-cultural-heritage
Pressure, Force, Motion, and Humidity Sensors ;Intermediate;24;4.8;TRUE;TRUE;https://www.coursera.org/learn/pressure-force-motion-humidity-sensors
ÉCHELLE RACE: Dépistage préhospitalier de l’AVC impliquant une occlusion de gros vaisseaux cérébraux;Intermediate;3;4.8;TRUE;TRUE;https://www.coursera.org/learn/prestorace-fr
La gestión de los riesgos y la administración de los cambios en el proyecto;NA;8;4.8;TRUE;TRUE;https://www.coursera.org/learn/presupuestos-proyecto
Cancer Prevention Web-Based Activity;Beginner;4;4.7;TRUE;TRUE;https://www.coursera.org/learn/prevent-cancer
Preventative Healthcare for the Newborn Baby ;Beginner;15;4.8;TRUE;TRUE;https://www.coursera.org/learn/preventive-healthcare-newborn-baby
Pricing Options with Mathematical Models;Intermediate;69;NA;TRUE;TRUE;https://www.coursera.org/learn/pricing-options-with-mathematical-models
Pricing Strategy;NA;14;4.6;TRUE;TRUE;https://www.coursera.org/learn/pricing-strategy
Primate Conservation;Beginner;11;4.5;TRUE;TRUE;https://www.coursera.org/learn/primate-conservation
Primeros Auxilios Psicológicos ;Beginner;11;4.8;TRUE;TRUE;https://www.coursera.org/learn/primeros-auxilios-psicologicos
Principais Elementos do Sucesso do Cliente;Beginner;41;NA;TRUE;TRUE;https://www.coursera.org/learn/principais-elementos-do-sucesso-do-cliente
Princípios básicos da publicidade em mídias sociais;Beginner;9;NA;TRUE;TRUE;https://www.coursera.org/learn/principios-basicos-da-publicidade-em-midias-sociais
Princípios de Desenvolvimento Ágil de Software;Intermediate;17;4.6;TRUE;TRUE;https://www.coursera.org/learn/principios-de-desenvolvimento-agil-de-software
Principios esenciales de diseño en Tableau;Beginner;8;NA;TRUE;TRUE;https://www.coursera.org/learn/principios-esenciales-de-diseno-en-tableau
Principios y Regulaciones de Seguridad de la Información;Beginner;16;NA;TRUE;TRUE;https://www.coursera.org/learn/principios-y-regulaciones-de-seguridad-de-la-informacion
Principles of Computing (Part 1);Intermediate;19;4.7;TRUE;TRUE;https://www.coursera.org/learn/principles-of-computing-1
Principles of Computing (Part 2);NA;16;4.8;TRUE;TRUE;https://www.coursera.org/learn/principles-of-computing-2
Principles of Corporate Finance –  A Tale of Value;Intermediate;26;NA;TRUE;TRUE;https://www.coursera.org/learn/principles-of-corporate-finance
Principles of Management;Intermediate;22;NA;TRUE;TRUE;https://www.coursera.org/learn/principles-of-management
Principles of Public Relations;Beginner;7;NA;TRUE;TRUE;https://www.coursera.org/learn/principles-of-public-relations
Квантовая механика. Часть 1. Принципы квантовой механики;Intermediate;37;NA;TRUE;TRUE;https://www.coursera.org/learn/principles-of-quantum-mechanic
Privacy & Standardisation Capstone;Intermediate;24;NA;TRUE;TRUE;https://www.coursera.org/learn/privacy-capstone
Privacy in Europe;Intermediate;18;4.5;TRUE;TRUE;https://www.coursera.org/learn/privacy-eu
Privacy Law and Data Protection;NA;12;4.8;TRUE;TRUE;https://www.coursera.org/learn/privacy-law-data-protection
Privacy Law and HIPAA;NA;12;4.4;TRUE;TRUE;https://www.coursera.org/learn/privacy-law-hipaa
Privacy in the USA;Intermediate;9;4.3;TRUE;TRUE;https://www.coursera.org/learn/privacy-laws-us
Private Cloud Management on IBM Power Systems;Intermediate;14;4.9;TRUE;TRUE;https://www.coursera.org/learn/private-cloud-ibm-power-systems
Private Equity and Venture Capital;NA;10;4.8;TRUE;TRUE;https://www.coursera.org/learn/private-equity
Capital-investissement et capital-risque;NA;10;NA;TRUE;TRUE;https://www.coursera.org/learn/private-equity-fr
Proactive Computer Security;Beginner;11;4.7;TRUE;TRUE;https://www.coursera.org/learn/proactive-computer-security
Теория вероятностей и ее приложения;Beginner;48;NA;TRUE;TRUE;https://www.coursera.org/learn/prob-theory
頑想學概率：機率一 (Probability (1));Beginner;9;4.8;TRUE;TRUE;https://www.coursera.org/learn/prob1
頑想學概率：機率二 (Probability (2));NA;12;4.8;TRUE;TRUE;https://www.coursera.org/learn/prob2
Fundamentos de probabilidad y aplicaciones;Intermediate;16;4.8;TRUE;TRUE;https://www.coursera.org/learn/probabilidad
Probabilistic Deep Learning with TensorFlow 2;Advanced;53;4.7;TRUE;TRUE;https://www.coursera.org/learn/probabilistic-deep-learning-with-tensorflow2
Probabilistic Graphical Models 1: Representation;Advanced;67;4.6;TRUE;TRUE;https://www.coursera.org/learn/probabilistic-graphical-models
Probabilistic Graphical Models 2: Inference;Advanced;38;4.6;TRUE;TRUE;https://www.coursera.org/learn/probabilistic-graphical-models-2-inference
Probabilistic Graphical Models 3: Learning;Advanced;66;4.6;TRUE;TRUE;https://www.coursera.org/learn/probabilistic-graphical-models-3-learning
Natural Language Processing with Probabilistic Models;Intermediate;31;4.7;TRUE;TRUE;https://www.coursera.org/learn/probabilistic-models-in-nlp
Aléatoire : une introduction aux probabilités - Partie 1;NA;28;4.5;TRUE;TRUE;https://www.coursera.org/learn/probabilites-1
Aléatoire : une introduction aux probabilités - Partie 2;NA;17;4.5;TRUE;TRUE;https://www.coursera.org/learn/probabilites-2
Introduction to Probability and Data with R;Beginner;14;4.7;TRUE;TRUE;https://www.coursera.org/learn/probability-intro
R을 사용한 확률 및 데이터 소개;Beginner;14;NA;TRUE;TRUE;https://www.coursera.org/learn/probability-intro-ko
Probability and Statistics: To p or not to p?;Beginner;16;4.6;TRUE;TRUE;https://www.coursera.org/learn/probability-statistics
Теория вероятностей для начинающих;Beginner;23;4.8;TRUE;TRUE;https://www.coursera.org/learn/probability-theory-basics
Probability Theory: Foundation for Data Science;Intermediate;48;4.3;TRUE;TRUE;https://www.coursera.org/learn/probability-theory-foundation-for-data-science
Probability Theory, Statistics and Exploratory Data Analysis;;22;4.7;TRUE;TRUE;https://www.coursera.org/learn/probability-theory-statistics
Effective Problem-Solving and Decision-Making;NA;5;4.5;TRUE;TRUE;https://www.coursera.org/learn/problem-solving
Problem Solving, Python Programming, and Video Games;Beginner;80;4.3;TRUE;TRUE;https://www.coursera.org/learn/problem-solving-programming-video-games
Problem-Solving Skills for University Success;Beginner;23;4.9;TRUE;TRUE;https://www.coursera.org/learn/problem-solving-skills
مهارات حل المسائل لتحقيق النجاح في الجامعة;Beginner;24;NA;TRUE;TRUE;https://www.coursera.org/learn/problem-solving-skills-ar
Process Data from Dirty to Clean;Beginner;22;4.8;TRUE;TRUE;https://www.coursera.org/learn/process-data
Process Improvement;NA;19;4.6;TRUE;TRUE;https://www.coursera.org/learn/process-improvement
Process Mining: Data science in Action;Intermediate;22;4.7;TRUE;TRUE;https://www.coursera.org/learn/process-mining
Processing of Space Monitoring Information;Advanced;14;NA;TRUE;TRUE;https://www.coursera.org/learn/processing-of-space-monitoring-information
Procurement Basics;Beginner;6;4.7;TRUE;TRUE;https://www.coursera.org/learn/procurement-basics
Procurement Negotiation;Beginner;8;4.8;TRUE;TRUE;https://www.coursera.org/learn/procurement-negotiation
Strategic Procurement and Sourcing Conclusions;Beginner;4;4.8;TRUE;TRUE;https://www.coursera.org/learn/procurement-sourcing-conclusions
Procurement & Sourcing Introduction;Beginner;4;4.7;TRUE;TRUE;https://www.coursera.org/learn/procurement-sourcing-introduction
Produção final do músico moderno;Intermediate;10;NA;TRUE;TRUE;https://www.coursera.org/learn/producao-musico-moderno
Introducción a la producción de música;NA;19;4.7;TRUE;TRUE;https://www.coursera.org/learn/produccion-musical
Producción Musical y su Efecto en la Composición;NA;21;4.9;TRUE;TRUE;https://www.coursera.org/learn/produccionycomposicion
The Art of Music Production;Intermediate;14;4.8;TRUE;TRUE;https://www.coursera.org/learn/producing-music
Product Management Essentials;Beginner;6;4.5;TRUE;TRUE;https://www.coursera.org/learn/product-management-essentials
Основы продакт-менеджмента;Beginner;7;NA;TRUE;TRUE;https://www.coursera.org/learn/product-management-fundamentals
Productivity and Systems Development;Beginner;16;NA;TRUE;TRUE;https://www.coursera.org/learn/productivity-systems-development
Продвижение веб-сайтов;Beginner;9;NA;TRUE;TRUE;https://www.coursera.org/learn/prodvizheniye-veb-saytov
Финансовая грамотность. Проект;Beginner;5;NA;TRUE;TRUE;https://www.coursera.org/learn/proekt
Основы проектирования приложений интернета вещей	;Intermediate;8;NA;TRUE;TRUE;https://www.coursera.org/learn/proektirovaniya-prilozhenij-interneta-veshchej
Shaping Your Professional Brand;Beginner;23;5.0;TRUE;TRUE;https://www.coursera.org/learn/professional-brand
Practical Guide to Navigating Professional Relationships;Beginner;20;NA;TRUE;TRUE;https://www.coursera.org/learn/professional-communication-skills-sales
Guía práctica para gestionar las relaciones profesionales;Beginner;20;NA;TRUE;TRUE;https://www.coursera.org/learn/professional-communication-skills-sales-es
Professional development: Improve yourself, always;NA;18;4.8;TRUE;TRUE;https://www.coursera.org/learn/professional-development-improve-yourself
