Страховое дело;NA;20;NA;TRUE;TRUE;https://www.coursera.org/learn/instrumenty-pozitivnoy-psikhologii-menedzhmente
 Международное трудовое право;NA;14;NA;TRUE;TRUE;https://www.coursera.org/learn/insurance
Intermediate Intel® Distribution of OpenVINO™ toolkit for Deep Learning Applications;Intermediate;5;NA;TRUE;TRUE;https://www.coursera.org/learn/int-lab-law-ru
История международных отношений;Beginner;13;NA;TRUE;TRUE;https://www.coursera.org/learn/int-openvino
Integración y preparación de datos;Beginner;20;NA;TRUE;TRUE;https://www.coursera.org/learn/int-relations-history
Integrated Analysis in Systems Biology;NA;4;4.6;TRUE;TRUE;https://www.coursera.org/learn/integracion-y-preparacion-de-datos
Integrated Marketing Communications: Advertising, Public Relations, Digital Marketing and more;NA;11;4.7;TRUE;TRUE;https://www.coursera.org/learn/integrated-analysis
Calculus: Single Variable Part 3 - Integration;NA;17;4.9;TRUE;FALSE;https://www.coursera.org/learn/integrated-marketing-communications
Introduction to Integrative Therapies and Healing Practices;Beginner;18;4.7;TRUE;TRUE;https://www.coursera.org/learn/integration-calculus
Introduction to Intel® Distribution of OpenVINO™ toolkit for Computer Vision Applications;Beginner;3;4.6;TRUE;TRUE;https://www.coursera.org/learn/integrative-therapies-and-healing-practices
Inteligencia Artificial centrada en el ser humano;Beginner;24;NA;TRUE;TRUE;https://www.coursera.org/learn/intel-openvino
Inteligência Artificial para Logística;Beginner;33;NA;TRUE;TRUE;https://www.coursera.org/learn/inteligencia-artificial-centrada-en-el-ser-humano
Intellectual Change in Early China: Warring States and Han;Intermediate;23;4.6;TRUE;TRUE;https://www.coursera.org/learn/inteligencia-artificial-para-logistica
Severe to Profound Intellectual Disability: Circles of Care and Education;Beginner;14;4.7;TRUE;TRUE;https://www.coursera.org/learn/intellectual-change-early-china-the-warring-states-han
Intellectual Humility: Practice;Beginner;19;4.7;TRUE;TRUE;https://www.coursera.org/learn/intellectual-disability-care-education
Intellectual Humility: Science;Beginner;21;4.7;TRUE;TRUE;https://www.coursera.org/learn/intellectual-humility-practice
Intellectual Humility: Theory;Beginner;18;4.5;TRUE;TRUE;https://www.coursera.org/learn/intellectual-humility-science
Intellectual Property for Entrepreneurs;Beginner;9;NA;TRUE;TRUE;https://www.coursera.org/learn/intellectual-humility-theory
Интеллектуальная собственность для бизнесмена;Beginner;4;NA;TRUE;TRUE;https://www.coursera.org/learn/intellectual-property-for-entrepreneurs
Intellectual Property in the Healthcare Industry;Beginner;13;4.8;TRUE;TRUE;https://www.coursera.org/learn/intellectual-property-for-managers
Intellectual Property Law in Digital Age;Beginner;7;NA;TRUE;TRUE;https://www.coursera.org/learn/intellectual-property-healthcare-industry
Intelligence Tools for the Digital Age ;Beginner;8;4.7;TRUE;TRUE;https://www.coursera.org/learn/intellectual-property-law-in-digital-age
Intelligent Machining;Beginner;11;4.6;TRUE;TRUE;https://www.coursera.org/learn/intelligence-tools-digital-age
Право интеллектуальной собственности в цифровую эпоху;Beginner;13;NA;TRUE;TRUE;https://www.coursera.org/learn/intelligent-machining
Interacting with the System and Managing Memory;Beginner;23;4.4;TRUE;TRUE;https://www.coursera.org/learn/intelpro
Interaction Design Capstone Project;NA;36;4.5;TRUE;TRUE;https://www.coursera.org/learn/interacting-system-managing-memory
Input and Interaction;NA;9;4.6;TRUE;TRUE;https://www.coursera.org/learn/interaction-design-capstone
Building Interactive 3D Characters and Social VR;Intermediate;13;4.3;TRUE;TRUE;https://www.coursera.org/learn/interaction-techniques
Interactive Computer Graphics;Intermediate;28;4.1;TRUE;TRUE;https://www.coursera.org/learn/interactive-3d-characters-social-virtual-reality
Online Games: Literature, New Media, and Narrative;Beginner;21;4.6;TRUE;TRUE;https://www.coursera.org/learn/interactive-computer-graphics
An Introduction to Interactive Programming in Python (Part 1);NA;19;4.8;TRUE;TRUE;https://www.coursera.org/learn/interactive-media-gaming
An Introduction to Interactive Programming in Python (Part 2);Beginner;16;4.9;TRUE;TRUE;https://www.coursera.org/learn/interactive-python-1
Interactive Teaching（インタラクティブ・ティーチング）;NA;26;NA;TRUE;TRUE;https://www.coursera.org/learn/interactive-python-2
Interactivity with JavaScript and jQuery;NA;15;NA;TRUE;TRUE;https://www.coursera.org/learn/interactive-teaching
Intercultural Management;Beginner;15;4.6;TRUE;TRUE;https://www.coursera.org/learn/interactivity-javascript-jquery
Intercultural Communication and Conflict Resolution;NA;5;4.4;TRUE;TRUE;https://www.coursera.org/learn/intercultural
Understanding Russians: Contexts of Intercultural Communication;Beginner;32;4.6;TRUE;TRUE;https://www.coursera.org/learn/intercultural-communication
Becoming Part of the Globalised Workplace;NA;11;4.4;TRUE;TRUE;https://www.coursera.org/learn/intercultural-communication-russians
Comprender las dimensiones interculturales en la cotidianidad;Intermediate;27;4.8;TRUE;TRUE;https://www.coursera.org/learn/intercultural-communications
Compreender as dimensões interculturais na vida cotidiana;Intermediate;18;NA;TRUE;TRUE;https://www.coursera.org/learn/interculturalidad
Interest Rate Models;Advanced;30;4.5;TRUE;TRUE;https://www.coursera.org/learn/interculturalidade
Interfacing with the Arduino;NA;11;4.7;TRUE;TRUE;https://www.coursera.org/learn/interest-rate-models
Introduction to Integrative Nursing;Beginner;16;4.9;TRUE;TRUE;https://www.coursera.org/learn/interface-with-arduino
Business Chinese 1 中级汉语 （上）;Intermediate;26;NA;TRUE;TRUE;https://www.coursera.org/learn/intergrative-nursing-introduction
Intermediate Grammar Project;Intermediate;25;4.8;TRUE;TRUE;https://www.coursera.org/learn/intermediate-business-chinese-1
Intermediate Object-Oriented Programming for Unreal Games;Intermediate;16;NA;TRUE;TRUE;https://www.coursera.org/learn/intermediate-grammar-capstone
Intermediate Object-Oriented Programming for Unity Games;Intermediate;53;4.6;TRUE;TRUE;https://www.coursera.org/learn/intermediate-object-oriented-programming--unreal-games
Intermediate PostgreSQL;Intermediate;16;4.9;TRUE;TRUE;https://www.coursera.org/learn/intermediate-object-oriented-programming-unity-games
Capstone: Analyzing (Social) Network Data;NA;18;4.7;TRUE;TRUE;https://www.coursera.org/learn/intermediate-postgresql
中级商务汉语——商务活动篇;Intermediate;31;NA;TRUE;TRUE;https://www.coursera.org/learn/intermediate-programming-capstone
Internal Displacement, Conflict and Protection;Beginner;27;NA;TRUE;TRUE;https://www.coursera.org/learn/intermediatechinesebusiness
Personnel & Third-Party Security;NA;10;4.7;TRUE;TRUE;https://www.coursera.org/learn/internal-displacement-conflict-and-protection
International Business II;NA;7;4.7;TRUE;TRUE;https://www.coursera.org/learn/internal-risk-mitigation
International Business Capstone;NA;11;4.7;TRUE;TRUE;https://www.coursera.org/learn/international-business-2
International Business Context;Beginner;15;4.7;TRUE;TRUE;https://www.coursera.org/learn/international-business-capstone
International Business and Culture;Beginner;12;4.7;TRUE;TRUE;https://www.coursera.org/learn/international-business-context
International Business Operations;Beginner;12;4.9;TRUE;TRUE;https://www.coursera.org/learn/international-business-culture
International Business Venturing Abroad;Beginner;12;4.8;TRUE;TRUE;https://www.coursera.org/learn/international-business-operations
Introduction to International Criminal Law;NA;13;4.8;TRUE;TRUE;https://www.coursera.org/learn/international-business-venturing-abroad
International Entertainment and Sports Marketing;NA;11;4.7;TRUE;TRUE;https://www.coursera.org/learn/international-criminal-law
Global Health Security, Solidarity and Sustainability through the International Health Regulations;Intermediate;25;4.7;TRUE;TRUE;https://www.coursera.org/learn/international-entertainment-sports-marketing
International Humanitarian Law in Theory and Practice ;Beginner;19;4.8;TRUE;TRUE;https://www.coursera.org/learn/international-health-regulations
Международная информационная безопасность: теория и практика;Beginner;5;NA;TRUE;TRUE;https://www.coursera.org/learn/international-humanitarian-law
Journalism, the future, and you!;Beginner;27;4.8;TRUE;TRUE;https://www.coursera.org/learn/international-information-security
 International Labour Law;Beginner;15;4.7;TRUE;TRUE;https://www.coursera.org/learn/international-journalism
International Law in Action: A Guide to the International Courts and Tribunals in The Hague;NA;18;4.8;TRUE;TRUE;https://www.coursera.org/learn/international-labour-law
International Law In Action: Investigating and Prosecuting International Crimes;NA;18;4.8;TRUE;TRUE;https://www.coursera.org/learn/international-law-in-action
International Marketing Entry and Execution;NA;9;4.7;TRUE;TRUE;https://www.coursera.org/learn/international-law-in-action-2
International migrations: a global issue;Beginner;23;4.7;TRUE;TRUE;https://www.coursera.org/learn/international-marketing-entry-execution
International and Cross-Cultural Negotiation;Intermediate;12;4.7;TRUE;TRUE;https://www.coursera.org/learn/international-migrations
التفاوض الدولي وبين الثقافات;Intermediate;12;NA;TRUE;TRUE;https://www.coursera.org/learn/international-negotiation
International Nuclear Law: Advanced Concepts;Intermediate;10;NA;TRUE;TRUE;https://www.coursera.org/learn/international-negotiation-ar
International Organizations for Interpreters;Beginner;17;NA;TRUE;TRUE;https://www.coursera.org/learn/international-nuclear-law-advanced-concepts
International Organizations Management ;Beginner;18;4.8;TRUE;TRUE;https://www.coursera.org/learn/international-organizations
International Portfolio Managment;Beginner;9;NA;TRUE;TRUE;https://www.coursera.org/learn/international-organizations-management
Foundations of International Psychiatry;Advanced;12;4.6;TRUE;TRUE;https://www.coursera.org/learn/international-portfolio-managment
Understanding International Relations Theory;NA;24;4.7;TRUE;TRUE;https://www.coursera.org/learn/international-psychiatry
International Security Management;Beginner;9;4.7;TRUE;TRUE;https://www.coursera.org/learn/international-relations-theory
Rethinking International Tax Law;NA;45;4.8;TRUE;TRUE;https://www.coursera.org/learn/international-security-management
Теории внешней торговли и торговой политики;Intermediate;23;NA;TRUE;TRUE;https://www.coursera.org/learn/international-taxation
International Travel Preparation, Safety, & Wellness;Beginner;10;4.7;TRUE;TRUE;https://www.coursera.org/learn/international-trade-theory
International Marketing & Cross Industry Growth Capstone Project  ;Intermediate;11;4.7;TRUE;TRUE;https://www.coursera.org/learn/international-travel
International Water Law;Intermediate;10;4.6;TRUE;TRUE;https://www.coursera.org/learn/international-vertical-marketing-capstone-project
Internet History, Technology, and Security;NA;15;4.8;TRUE;TRUE;https://www.coursera.org/learn/international-water-law
Internet of Things Capstone: Build a Mobile Surveillance System;NA;5;NA;TRUE;TRUE;https://www.coursera.org/learn/internet-history
Internet of Things Capstone V2: Build a Mobile Surveillance System;NA;5;NA;TRUE;TRUE;https://www.coursera.org/learn/internet-of-things-capstone
Internet of Things V2: Setting up and Using Cloud Services;NA;10;4.7;TRUE;TRUE;https://www.coursera.org/learn/internet-of-things-capstone-version2
Internet of Things: Communication Technologies;NA;6;4.6;TRUE;TRUE;https://www.coursera.org/learn/internet-of-things-cloud-services-version2
Internet of Things: Setting Up Your DragonBoard™ Development Platform;NA;18;4.2;TRUE;TRUE;https://www.coursera.org/learn/internet-of-things-communication
Internet of Things V2: DragonBoard™ bring up and community ecosystem;NA;21;3.4;TRUE;TRUE;https://www.coursera.org/learn/internet-of-things-dragonboard
Internet of Things: How did we get here?;NA;21;3.9;TRUE;TRUE;https://www.coursera.org/learn/internet-of-things-dragonboard-version2
Internet of Things: Multimedia Technologies;NA;5;4.6;TRUE;TRUE;https://www.coursera.org/learn/internet-of-things-history
Programming for the Internet of Things Project;NA;6;4.7;TRUE;TRUE;https://www.coursera.org/learn/internet-of-things-multimedia
Internet of Things: Sensing and Actuation From Devices;NA;16;4.5;TRUE;TRUE;https://www.coursera.org/learn/internet-of-things-project
Интернет-предпринимательство;Beginner;19;NA;TRUE;TRUE;https://www.coursera.org/learn/internet-of-things-sensing-actuation
Internet Giants: The Law and Economics of Media Platforms;NA;60;4.8;TRUE;TRUE;https://www.coursera.org/learn/internet-predprinimatelstvo
Interpersonal Communication for Engineering Leaders;;22;4.8;TRUE;TRUE;https://www.coursera.org/learn/internetgiants
Interventions and Calibration;Intermediate;24;4.6;TRUE;TRUE;https://www.coursera.org/learn/interpersonal-communication
Interview Research and Preparation;Intermediate;20;4.6;TRUE;TRUE;https://www.coursera.org/learn/interventions-and-calibration
Advanced Interviewing Techniques;NA;21;4.7;TRUE;TRUE;https://www.coursera.org/learn/interview-preparation
Intimacy of Creativity: Entering the Minds of Composers;Intermediate;5;4.5;TRUE;TRUE;https://www.coursera.org/learn/interview-techniques
Introduction to Abnormal Psychology;Beginner;14;5.0;TRUE;TRUE;https://www.coursera.org/learn/intimacy-creativity-entering-minds-composers
Introduction to Accounting Data Analytics and Visualization;Beginner;19;4.8;TRUE;TRUE;https://www.coursera.org/learn/intro-abnormal-psych
Intro to Analytic Thinking, Data Science, and Data Mining;Intermediate;7;4.1;TRUE;TRUE;https://www.coursera.org/learn/intro-accounting-data-analytics-visual
Introduction to Android graphics;Intermediate;20;4.1;TRUE;TRUE;https://www.coursera.org/learn/intro-analyticthinking-datascience-datamining
走进天文学;Beginner;11;NA;TRUE;TRUE;https://www.coursera.org/learn/intro-android-graphics
Intro to AR/VR/MR/XR: Technologies, Applications & Issues;Beginner;28;4.7;TRUE;TRUE;https://www.coursera.org/learn/intro-astronomy-nju
Introduction to Blockchain for Financial Services;Beginner;29;4.7;TRUE;TRUE;https://www.coursera.org/learn/intro-augmented-virtual-mixed-extended-reality-technologies-applications-issues
Introduction to Business Analytics: Communicating with Data ;Intermediate;15;4.6;TRUE;TRUE;https://www.coursera.org/learn/intro-blockchain-financial-services
Introduction to Chemistry:  Reactions and Ratios;Beginner;18;4.7;TRUE;TRUE;https://www.coursera.org/learn/intro-business-analytics
Introduction to English Common Law;Beginner;20;4.8;TRUE;TRUE;https://www.coursera.org/learn/intro-chemistry
Introduction to Cyber Attacks;Beginner;19;4.7;TRUE;TRUE;https://www.coursera.org/learn/intro-common-law
Introduction to Cybersecurity for Business;Beginner;12;4.7;TRUE;TRUE;https://www.coursera.org/learn/intro-cyber-attacks
Introducción a Data Science: Programación Estadística con R;Beginner;47;4.7;TRUE;TRUE;https://www.coursera.org/learn/intro-cyber-security-business
Introduction to Economic Theories;Beginner;41;4.4;TRUE;TRUE;https://www.coursera.org/learn/intro-data-science-programacion-estadistica-r
Introduction to FPGA Design for Embedded Systems;Intermediate;18;4.6;TRUE;TRUE;https://www.coursera.org/learn/intro-economic-theories
Introdução à Guitarra;Beginner;20;NA;TRUE;TRUE;https://www.coursera.org/learn/intro-fpga-design-embedded-systems
Introduction to Indoor Air Quality;Beginner;12;4.7;TRUE;TRUE;https://www.coursera.org/learn/intro-guitarra
Intro to International Marketing;;8;4.7;TRUE;TRUE;https://www.coursera.org/learn/intro-indoor-air-quality
Introduction to Java as a Second Language;Intermediate;7;NA;TRUE;TRUE;https://www.coursera.org/learn/intro-international-marketing
Introduction to Learning Transfer and Life Long Learning (3L);Beginner;6;4.6;TRUE;TRUE;https://www.coursera.org/learn/intro-java-second-language
NA;NA;NA;NA;FALSE;FALSE;https://www.coursera.org/learn/intro-learning-transfer
Introducción a la producción audiovisual;Beginner;23;4.7;TRUE;TRUE;https://www.coursera.org/learn/intro-practical-deep-learning
Introducción a la producción musical ;Intermediate;14;4.8;TRUE;TRUE;https://www.coursera.org/learn/intro-produccion-audiovisual
Code Yourself! An Introduction to Programming;Beginner;12;4.7;TRUE;TRUE;https://www.coursera.org/learn/intro-produccion-musical
برمج بنفسك! مقدمة حول البرمجة;NA;12;NA;TRUE;TRUE;https://www.coursera.org/learn/intro-programming
Introducción a las redes sociales. Sus objetivos y métricas. ;Beginner;15;4.4;TRUE;TRUE;https://www.coursera.org/learn/intro-programming-ar
Introduction to Religions & Ecology;Beginner;15;NA;TRUE;TRUE;https://www.coursera.org/learn/intro-redes-sociales
Introduction to Reproducibility in Cancer Informatics;Intermediate;7;NA;TRUE;TRUE;https://www.coursera.org/learn/intro-religions-ecology
Introduction to Self-Driving Cars;Advanced;35;4.7;TRUE;TRUE;https://www.coursera.org/learn/intro-reproducibility-cancer-informatics
Introduction to Structured Query Language (SQL);Intermediate;16;4.8;TRUE;TRUE;https://www.coursera.org/learn/intro-self-driving-cars
Introduction to TensorFlow;Intermediate;19;4.4;FALSE;TRUE;https://www.coursera.org/learn/intro-sql
Intro to TensorFlow em Português Brasileiro;Intermediate;18;NA;FALSE;TRUE;https://www.coursera.org/learn/intro-tensorflow
Intro to TensorFlow en Español;Intermediate;18;4.4;FALSE;TRUE;https://www.coursera.org/learn/intro-tensorflow-br
Intro to TensorFlow en Français;Intermediate;19;NA;FALSE;TRUE;https://www.coursera.org/learn/intro-tensorflow-es
Intro to TensorFlow 日本語版;Intermediate;19;NA;FALSE;TRUE;https://www.coursera.org/learn/intro-tensorflow-fr
Introdução ao Teste de Software;Beginner;16;4.8;TRUE;TRUE;https://www.coursera.org/learn/intro-tensorflow-jp
Intro to Acoustics (Part 1);Intermediate;14;4.5;TRUE;TRUE;https://www.coursera.org/learn/intro-teste-de-software
Introduction to Acoustics (Part 2);Intermediate;13;4.7;TRUE;TRUE;https://www.coursera.org/learn/intro-to-acoustics
Introduction to Data Analytics for Accounting Professionals;Beginner;8;NA;TRUE;TRUE;https://www.coursera.org/learn/intro-to-acoustics-2
Introduction to Deep Learning;Advanced;34;4.5;TRUE;TRUE;https://www.coursera.org/learn/intro-to-data-analytics
Introduction to DevOps;Beginner;6;NA;TRUE;TRUE;https://www.coursera.org/learn/intro-to-deep-learning
Introduction to Healthcare;Beginner;12;4.8;TRUE;TRUE;https://www.coursera.org/learn/intro-to-devops
Introduction to numerical analysis;Intermediate;18;4.7;TRUE;TRUE;https://www.coursera.org/learn/intro-to-healthcare
Introduction to Political Philosophy;NA;42;NA;TRUE;TRUE;https://www.coursera.org/learn/intro-to-numerical-analysis
Introduction to Translational Science;Beginner;11;4.5;TRUE;TRUE;https://www.coursera.org/learn/intro-to-political-philosophy
Introduction to Ancient Egypt and Its Civilization;Intermediate;8;4.6;TRUE;TRUE;https://www.coursera.org/learn/intro-translational-science
Introduction to Classical Music;NA;66;4.9;TRUE;TRUE;https://www.coursera.org/learn/introancientegypt
Introduction to CSS3;NA;12;4.8;TRUE;TRUE;https://www.coursera.org/learn/introclassicalmusic
مقدمة عن CSS3;NA;12;NA;TRUE;TRUE;https://www.coursera.org/learn/introcss
Introdução à Ciência e Engenharia de Dados;Beginner;31;NA;TRUE;TRUE;https://www.coursera.org/learn/introcss-ar
Introdução à Análise Macroeconômica;Intermediate;23;4.8;TRUE;TRUE;https://www.coursera.org/learn/introducao-a-ciencia-e-engenharia-de-dados
Introdução ao marketing de mídias sociais;Beginner;15;NA;TRUE;TRUE;https://www.coursera.org/learn/introducao-analise-macroeconomica
Introdução ao Workforce Management;Beginner;23;NA;TRUE;TRUE;https://www.coursera.org/learn/introducao-ao-marketing-de-midias-sociais
Introdução ao Desenvolvimento de Aplicativos Android;Intermediate;7;4.6;TRUE;TRUE;https://www.coursera.org/learn/introducao-ao-workforce-management
Introdução ao Big Data ;Beginner;16;4.6;TRUE;TRUE;https://www.coursera.org/learn/introducao-aplicativos-android
Introdução às Tecnologias Blockchain;Beginner;29;4.9;TRUE;TRUE;https://www.coursera.org/learn/introducao-big-data
Introducción a la gestión ágil de proyectos;Beginner;54;NA;TRUE;TRUE;https://www.coursera.org/learn/introducao-tecnologias-blockchain
Introducción a Lean Six Sigma;Beginner;27;4.7;TRUE;TRUE;https://www.coursera.org/learn/introduccin-a-la-gestin-gil-de-proyectos
Introducción a Contenedores con Docker y Kubernetes ;Beginner;11;NA;TRUE;TRUE;https://www.coursera.org/learn/introduccin-a-lean-six-sigma
Introducción a la Computación en la Nube;Beginner;12;NA;TRUE;TRUE;https://www.coursera.org/learn/introduccion-a-contenedores-con-docker
Introducción a La Inteligencia Artificial (IA);Beginner;9;4.7;TRUE;TRUE;https://www.coursera.org/learn/introduccion-a-la-computacion-en-la-nube
Introducción a la inteligencia emocional;Beginner;11;4.6;TRUE;TRUE;https://www.coursera.org/learn/introduccion-a-la-inteligencia-artificial
Introducción a la Psicología;Beginner;12;4.6;TRUE;TRUE;https://www.coursera.org/learn/introduccion-a-la-inteligencia-emocional
Introducción al Aprendizaje Profundo;Beginner;7;NA;TRUE;TRUE;https://www.coursera.org/learn/introduccion-a-la-psicologia
Pre-Calculus;Beginner;47;4.6;TRUE;TRUE;https://www.coursera.org/learn/introduccion-al-aprendizaje-profundo
Introducción al marketing en redes sociales;Beginner;15;4.9;TRUE;TRUE;https://www.coursera.org/learn/introduccion-al-calculo
Introducción al procesamiento de lenguaje natural;Beginner;13;4.5;TRUE;TRUE;https://www.coursera.org/learn/introduccion-al-marketing-en-redes-sociales
Introducción al Arte Sonoro;Beginner;7;4.8;TRUE;TRUE;https://www.coursera.org/learn/introduccion-al-procesamiento-de-lenguaje-natural
Introducción a la ciencia de datos aplicada;Beginner;20;NA;TRUE;TRUE;https://www.coursera.org/learn/introduccion-arte-sonoro
Introducción al desarrollo web;Beginner;14;4.6;TRUE;TRUE;https://www.coursera.org/learn/introduccion-ciencia-de-datos-aplicada
Introducción a Java;Beginner;30;4.2;TRUE;TRUE;https://www.coursera.org/learn/introduccion-desarrollo-web
Introducción a la programación orientada a objetos en Java;Beginner;73;4.6;TRUE;TRUE;https://www.coursera.org/learn/introduccion-java
Introducción a la programación con Python;Beginner;17;4.6;TRUE;TRUE;https://www.coursera.org/learn/introduccion-programacion-java
Introducción a la estrategia;NA;12;4.8;TRUE;TRUE;https://www.coursera.org/learn/introduccion-python
Introducing z/OS UNIX System Services;Intermediate;13;NA;TRUE;TRUE;https://www.coursera.org/learn/introduccionalaestrategia
Introduction to Advanced Vibrations;Intermediate;14;4.8;TRUE;TRUE;https://www.coursera.org/learn/introducing-zos-unix-system-services
Introducción al Análisis de Datos;Beginner;11;4.6;TRUE;TRUE;https://www.coursera.org/learn/introduction-advanced-vibrations
Introduction to Basic Vibrations;Intermediate;6;4.6;TRUE;TRUE;https://www.coursera.org/learn/introduction-al-analisis-de-datos
Introduction to Blockchain Technologies;Beginner;29;4.7;TRUE;TRUE;https://www.coursera.org/learn/introduction-basic-vibrations
Introduction to CAD, CAM, and Practical CNC Machining;Advanced;25;4.8;TRUE;TRUE;https://www.coursera.org/learn/introduction-blockchain-technologies
Introduction to Climate Change and Health;Beginner;15;4.8;TRUE;TRUE;https://www.coursera.org/learn/introduction-cad-cam-practical-cnc-machining
Introduction to Clinical Data;Beginner;12;4.6;TRUE;TRUE;https://www.coursera.org/learn/introduction-climate-change-health
Introduction to Clinical Data Science;Intermediate;8;4.6;TRUE;TRUE;https://www.coursera.org/learn/introduction-clinical-data
Introduction to Computer Vision and Image Processing;Beginner;22;4.4;TRUE;TRUE;https://www.coursera.org/learn/introduction-clinical-data-science
Introduction to Cybersecurity Tools & Cyber Attacks;Beginner;20;4.5;TRUE;TRUE;https://www.coursera.org/learn/introduction-computer-vision-watson-opencv
Introduction to Digital Health Entrepreneurship;Beginner;7;NA;TRUE;TRUE;https://www.coursera.org/learn/introduction-cybersecurity-cyber-attacks
Intro to Digital Manufacturing with Autodesk Fusion 360;Beginner;12;4.6;TRUE;TRUE;https://www.coursera.org/learn/introduction-digital-health-entrepreneurship
Introduction to Digital Marketing;Beginner;9;4.8;TRUE;TRUE;https://www.coursera.org/learn/introduction-digital-manufacturing-fusion-360
Introduction to Embedded Systems Software and Development Environments;Intermediate;9;4.5;TRUE;TRUE;https://www.coursera.org/learn/introduction-digital-marketing
Introduction to Enterprise Computing;Beginner;10;4.7;TRUE;TRUE;https://www.coursera.org/learn/introduction-embedded-systems
Experimental Design Basics;Intermediate;13;4.7;TRUE;TRUE;https://www.coursera.org/learn/introduction-enterprise-computing
Introduction to Google Workspace 日本語版;Beginner;7;NA;TRUE;TRUE;https://www.coursera.org/learn/introduction-experimental-design-basics
Introduction to Genomic Technologies;NA;6;4.6;TRUE;TRUE;https://www.coursera.org/learn/introduction-g-suite-jp
Introduction to GIS Mapping;Beginner;14;4.9;TRUE;TRUE;https://www.coursera.org/learn/introduction-genomics
Introduction to Git and GitHub;Beginner;19;4.8;TRUE;TRUE;https://www.coursera.org/learn/introduction-gis-mapping
Introduction to Google Workspace Administration;Beginner;5;4.7;TRUE;TRUE;https://www.coursera.org/learn/introduction-git-github
Introduction to High-Performance and Parallel Computing;Beginner;18;3.0;TRUE;TRUE;https://www.coursera.org/learn/introduction-google-workspace
